<?xml version="1.0" encoding="UTF-8"?>
<!--
  Copyright (C) 2014-2018 Matthias Freund and others, Institute of Automation, TU Dresden
  
  This program and the accompanying materials are made
  available under the terms of the Eclipse Public License 2.0
  which is available at https://www.eclipse.org/legal/epl-2.0/
  
  Contributors:
    Institute of Automation, TU Dresden - Initial API and implementation
  
  SPDX-License-Identifier: EPL-2.0
-->
<disl
    xmlns:xsi="http://www.w3.org/2001/XMLSchema-instance" xsi:noNamespaceSchemaLocation="../metamodel/disl.xsd">
  <head>
    <meta content="Prozessvisualisierung_20110303_202702" name="modell-ID"/>
    <meta content="2.0" name="useML_schema_version"/>
    <meta content="hierarchie" name="struktur"/>
    <meta content="Prozessvisualisierung" name="bezeichnung"/>
    <meta content="" name="autoren"/>
    <meta content="2010-09-29" name="erstellungsdatum"/>
  </head>
  <interface id="Dialog_1" state="start">
    <structure>
      <widget generic-widget="choicegroup" id="eBO_1">
        <widget generic-widget="variablefield" id="eBO_1_0"/>
        <widget generic-widget="variablefield" id="eBO_1_1"/>
        <widget generic-widget="variablefield" id="eBO_1_2"/>
      </widget>
      <widget generic-widget="choicegroup" id="eBO_3">
        <widget generic-widget="variablefield" id="eBO_3_0"/>
        <widget generic-widget="variablefield" id="eBO_3_1"/>
        <widget generic-widget="variablefield" id="eBO_3_2"/>
      </widget>
      <widget generic-widget="textfield" id="eBO_5"/>
      <widget generic-widget="command" id="eBO_5_OK"/>
      <widget generic-widget="textfield" id="eBO_6"/>
      <widget generic-widget="command" id="eBO_6_OK"/>
    </structure>
    <style>
      <part generic-widget="eBO_1">
        <property generic-widget="choicegroup" id="title">Behaelterauswahl</property>
        <property generic-widget="choicegroup" id="description"></property>
        <property generic-widget="choicegroup" id="help"></property>
        <property generic-widget="choicegroup" id="visible">yes</property>
        <property generic-widget="choicegroup" id="activated">yes</property>
        <property generic-widget="choicegroup" id="type">exclusive</property>
        <property generic-widget="choicegroup" id="modified">no</property>
      </part>
      <part generic-widget="eBO_1_0">
        <property generic-widget="variablefield" id="title">Vorgabewert 0</property>
        <property generic-widget="variablefield" id="value">Behaelter_1 </property>
      </part>
      <part generic-widget="eBO_1_1">
        <property generic-widget="variablefield" id="title">Vorgabewert 1</property>
        <property generic-widget="variablefield" id="value">Behaelter_2 </property>
      </part>
      <part generic-widget="eBO_1_2">
        <property generic-widget="variablefield" id="title">Vorgabewert 2</property>
        <property generic-widget="variablefield" id="value">Behaelter_3 </property>
      </part>
      <part generic-widget="eBO_3">
        <property generic-widget="choicegroup" id="title">Pumpenauswahl</property>
        <property generic-widget="choicegroup" id="description"></property>
        <property generic-widget="choicegroup" id="help"></property>
        <property generic-widget="choicegroup" id="visible">yes</property>
        <property generic-widget="choicegroup" id="activated">yes</property>
        <property generic-widget="choicegroup" id="type">exclusive</property>
        <property generic-widget="choicegroup" id="modified">no</property>
      </part>
      <part generic-widget="eBO_3_0">
        <property generic-widget="variablefield" id="title">Vorgabewert 0</property>
        <property generic-widget="variablefield" id="value">Pumpe_1 </property>
      </part>
      <part generic-widget="eBO_3_1">
        <property generic-widget="variablefield" id="title">Vorgabewert 1</property>
        <property generic-widget="variablefield" id="value">Pumpe_2 </property>
      </part>
      <part generic-widget="eBO_3_2">
        <property generic-widget="variablefield" id="title">Vorgabewert 2</property>
        <property generic-widget="variablefield" id="value">Pumpe_3 </property>
      </part>
      <part generic-widget="eBO_5">
        <property generic-widget="textfield" id="title">Ist-Drehzahl</property>
        <property generic-widget="textfield" id="description"></property>
        <property generic-widget="textfield" id="help"></property>
        <property generic-widget="textfield" id="visible">yes</property>
        <property generic-widget="textfield" id="activated">yes</property>
        <property generic-widget="textfield" id="value"></property>
      </part>
      <part generic-widget="eBO_5_OK">
        <property generic-widget="command" id="title">OK</property>
        <property generic-widget="command" id="description">Bestaetigung, dass die Information wahrgenommen wurde</property>
        <property generic-widget="command" id="help">Betaetigen Sie dieses Kommando, wenn Sie die Information wahrgenommen haben</property>
        <property generic-widget="command" id="selected">no</property>
      </part>
      <part generic-widget="eBO_6">
        <property generic-widget="textfield" id="title">Ist-Fuellstand</property>
        <property generic-widget="textfield" id="description"></property>
        <property generic-widget="textfield" id="help"></property>
        <property generic-widget="textfield" id="visible">yes</property>
        <property generic-widget="textfield" id="activated">yes</property>
        <property generic-widget="textfield" id="value"></property>
      </part>
      <part generic-widget="eBO_6_OK">
        <property generic-widget="command" id="title">OK</property>
        <property generic-widget="command" id="description">Bestaetigung, dass die Information wahrgenommen wurde</property>
        <property generic-widget="command" id="help">Betaetigen Sie dieses Kommando, wenn Sie die Information wahrgenommen haben</property>
        <property generic-widget="command" id="selected">no</property>
      </part>
    </style>
    <behavior>
      <variable id="Dialog_1_eBO_5_ConfirmationChanged" internal="no" type="boolean">false</variable>
      <variable id="Dialog_1_eBO_5_ConfirmationResult" internal="no" type="boolean">false</variable>
      <variable id="callerID" interface="ConfirmationDialog" internal="no" type="string"></variable>
      <rule id="eBO_1_Changed">
        <condition>
          <equal>
            <property-content property-id="selected" widget-id="eBO_1"/>
            <constant>yes</constant>
          </equal>
        </condition>
      </rule>
      <rule id="eBO_3_Changed">
        <condition>
          <equal>
            <property-content property-id="selected" widget-id="eBO_3"/>
            <constant>yes</constant>
          </equal>
        </condition>
      </rule>
      <rule id="eBO_5_Changed">
        <condition>
          <equal>
            <property-content property-id="selected" widget-id="eBO_5_OK"/>
            <constant>yes</constant>
          </equal>
        </condition>
      </rule>
      <rule id="eBO_5_ConfirmationYes">
        <condition>
          <op operator="and">
            <op-expression expression="equal">
              <variable-content variable-id="Dialog_1_eBO_5_ConfirmationChanged"/>
              <constant>true</constant>
            </op-expression>
            <op-expression expression="equal">
              <variable-content variable-id="Dialog_1_eBO_5_ConfirmationResult"/>
              <constant>true</constant>
            </op-expression>
          </op>
        </condition>
      </rule>
      <rule id="eBO_5_ConfirmationNo">
        <condition>
          <op operator="and">
            <op-expression expression="equal">
              <variable-content variable-id="Dialog_1_eBO_5_ConfirmationChanged"/>
              <constant>true</constant>
            </op-expression>
            <op-expression expression="equal">
              <variable-content variable-id="Dialog_1_eBO_5_ConfirmationResult"/>
              <constant>false</constant>
            </op-expression>
          </op>
        </condition>
      </rule>
      <rule id="eBO_6_Changed">
        <condition>
          <equal>
            <property-content property-id="selected" widget-id="eBO_6_OK"/>
            <constant>yes</constant>
          </equal>
        </condition>
      </rule>
      <transition>
        <if-true rule-id="eBO_1_Changed"/>
        <action>
          <interface-change interface-id="Dialog_2"/>
        </action>
      </transition>
      <transition>
        <if-true rule-id="eBO_3_Changed"/>
        <action>
          <interface-change interface-id="Dialog_3"/>
        </action>
      </transition>
      <transition>
        <if-true rule-id="eBO_5_Changed"/>
        <action>
          <statement assignment="set">
            <variable-content variable-id="callerID"/>
            <constant>Dialog_1_eBO_5</constant>
          </statement>
          <interface-change interface-id="ConfirmationDialog"/>
        </action>
      </transition>
      <transition>
        <if-true rule-id="eBO_5_ConfirmationYes"/>
        <action>
          <interface-change interface-id="Dialog_1"/>
        </action>
      </transition>
      <transition>
        <if-true rule-id="eBO_5_ConfirmationNo"/>
        <action>
          <statement assignment="set">
            <variable-content variable-id="Dialog_1_eBO_5_ConfirmationChanged"/>
            <constant>false</constant>
          </statement>
        </action>
      </transition>
      <transition>
        <if-true rule-id="eBO_6_Changed"/>
        <action>
          <interface-change interface-id="Dialog_1"/>
        </action>
      </transition>
    </behavior>
  </interface>
  <interface id="Dialog_2" state="other">
    <structure>
      <widget generic-widget="variablebox" id="eBO_2"/>